{"attempts":[{"attempt_id":"aaaaaaaaaaaaaaaaaaaaaaaaaaaaaaaaaaaaaaaaaaaaaaaaaaaaaaaaaaaaaaaa","attempt_key":"c51f8d76a836f935bed6402a3ca4b8e39a8055e9e9856ce32887c472d543aeca","execution_digest_sha256":"e123d3ce5fb3f3d16aed0b08c669f29933f84e2ab23d25efd38b63203d753ac2","mapping":{"omitted":[{"hotkey":"miner-a-hotkey","planned_uid":9}],"weights":[{"hotkey":"miner-b-hotkey","planned_uid":3,"uid":7,"weight":1.0}]},"netuid":24,"network":"finney","plan_digest_sha256":"f50cc12a7e6db2743346d54c3c1b7d287607389bbe35057cdc4d983b6353e67b","preflight_block":103,"receipt":{"error_code":null,"extrinsic_ref":"103-2","outcome":"confirmed"},"send_check_block":104,"started_at":"2026-08-24T12:00:00.000000Z","status":"confirmed","submission_started":true,"updated_at":"2026-08-24T12:00:01.000000Z","validator_hotkey":"validator-hotkey","version_key":2}],"digest_sha256":"96795140ecd1febe9031472891eb3b4fc3ff52f1ee52622758e1f9f43a5e37ed","schema":"miss.computer/misscomputer-subnet/weight-execution-audit","schema_version":1}
